{
  "opera_riferimento": {
    "titolo": "I quaranta giorni del Mussa Dagh",
    "autore": "Franz Werfel"
  },
  "tesi_interpretativa_centrale": {
    "tesi": "I quaranta giorni del Mussa Dagh non è il racconto di una resistenza che cerca di sopravvivere a uno sterminio: è il racconto di una comunità che, sapendosi destinata alla cancellazione amministrativa, costruisce — contro il vuoto preparato per essa — una forma piena di esistenza collettiva, e che misura la qualità di quella forma non sulla salvezza biologica ma sulla fedeltà a ciò che, alla fine, non sarà riassorbibile. La resistenza è qui un atto fondativo di senso, non strategico: i quaranta giorni del titolo non sono la cronaca di un assedio (storicamente cinquantatré giorni) ma il tempo, scelto su grammatica biblica, in cui un mondo umano si dà laddove era stato decretato il nulla. La morte solitaria di Gabriel sulla montagna abbandonata non è dunque un fallimento individuale e nemmeno un lutto privato: è la figura strutturale di un resto che la salvezza dei sopravvissuti non chiude, e che la separa per sempre dall'illusione di essere un semplice ritorno alla storia ordinaria.",
    "relazione_con_ipotesi_step2": "La tesi conferma l'ipotesi provvisoria dello Step 2 — la resistenza come gesto fondativo di senso e i quaranta giorni come tempo di costituzione di un mondo umano contro la cancellazione decretata — ma la precisa lungo due direzioni. Primo, sostituisce il linguaggio del 'sigillo di coerenza' (che rischiava di rendere la morte di Gabriel un compimento etico-narrativo) con quello, più rigoroso, del 'resto non simbolizzabile' e della 'separazione dall'onnipotenza': Gabriel non muore perché ha completato qualcosa, ma perché ciò che è stato perduto eccede ogni reintegrazione, e la fedeltà a quel resto è incompatibile con il reimbarco. Secondo, accoglie la cautela dello Step 2 sulla centralità eccessiva di Gabriel: la traiettoria del protagonista è funzione della configurazione collettiva, non viceversa, e il vero soggetto del romanzo è la comunità dei sette villaggi che si costituisce sull'altipiano.",
    "relazione_con_configurazione_step3": "La tesi si radica direttamente nella configurazione strutturale dominante emersa dallo Step 3: un soggetto collettivo che si costituisce come forma piena di esistenza umana (Asse 1) sotto la pressione di una deformazione storica estrema — l'apparato amministrativo del genocidio moderno (Asse 6) — nell'incontro frontale con il limite reale e il resto irriducibile della perdita (Asse 4). La normatività interna come giudizio situato (Asse 3) e il vincolo affettivo come istanza pre-normativa (Asse 2) operano come dimensioni necessarie ma subordinate a questa configurazione di fondo. La tesi assume in particolare la coesistenza, descritta nello Step 3, di costituzione piena del soggetto collettivo e esperienza del proprio possibile annientamento: non una fase che succede all'altra, ma un'unica struttura tenuta insieme per tutta la durata dei quaranta giorni e iscritta nell'architettura tripartita 'Untergang — Rettung — Untergang' del Libro terzo."
  },
  "testo_saggio": "# Quaranta giorni di mondo umano. Sulla resistenza del Musa Dagh\n\n## 1. Una montagna come soglia\n\nC'è un momento, verso la fine del primo Libro, in cui la decisione di non obbedire all'ordine di deportazione viene presa collettivamente. I rappresentanti dei sette villaggi cristiani della regione del Musa Dagh, convocati da Ter Haigasun e da Gabriel Bagradian, deliberano di salire sulla montagna che dà il titolo al romanzo: il Mussa Dagh, il monte di Mosè. Nulla, nelle norme disponibili a quella comunità — diritto consuetudinario, diritto religioso, prassi diplomatica del Sangiaccato di Alessandretta — prevedeva quel passaggio. L'assemblea decide ciò che nessuna procedura permetteva di decidere. È una scena di apertura nel senso letterale: apre un campo che prima non c'era. Da quel momento la quotidianità intatta dei villaggi diventa impossibile, e l'autogoverno armato — fino al giorno prima impensabile — diventa l'orizzonte effettivo entro cui cinquemila persone abitano il tempo che resta loro.\n\nQuesta scena, e non la prima battaglia, è il vero inizio del romanzo di Werfel. Da essa si entra in una struttura che il libro mantiene per tutto il proprio sviluppo: una comunità che, sapendo di essere stata condannata, decide di esistere come popolo per il tempo che le è concesso — e che misura il proprio esistere non sulla probabilità di sopravvivere ma sulla qualità della forma che riesce a darsi. La tesi che intendo svolgere è che *I quaranta giorni del Mussa Dagh* non sia, propriamente, un romanzo sulla sopravvivenza ad un genocidio. È un romanzo sulla costituzione di un mondo umano contro la sua decretata cancellazione, e sul resto che, alla fine, neppure la salvezza dei sopravvissuti potrà chiudere.\n\n## 2. La costituzione di un mondo\n\nSe si percorre con cura la cronologia del Libro secondo, ciò che colpisce non è il dettaglio degli scontri militari: è la minuziosità con cui Werfel descrive l'organizzazione interna dell'accampamento. Ci sono trincee, ma anche un consiglio dei capi che delibera; ci sono depositi di viveri, ma anche un ospedale da campo affidato al vecchio dottor Altouni; c'è una milizia, ma anche una scuola, e ci sono funzioni religiose celebrate da Ter Haigasun secondo il rito apostolico armeno. La montagna non è un bivacco di rifugiati: è una piccola polis. La comunità non si limita a tenersi in vita — il che, dato l'orizzonte, sarebbe già moltissimo: ordina il proprio campo intenzionale, decide ciò che vale e ciò che vale meno, distribuisce ruoli, sanziona, cura, educa, seppellisce i propri morti.\n\nQuesto è il punto centrale, e a esso il romanzo dedica un'attenzione che eccede di gran lunga le esigenze documentarie. La scelta di indugiare sull'organizzazione civile prima e accanto a quella militare non è secondaria: è il modo in cui Werfel mostra che la comunità del Musa Dagh non sta solo combattendo per la vita, ma sta combattendo per la propria forma. La differenza non è retorica. Si può sopravvivere riducendosi all'osso del biologico — al respiro, al mangiare, al ripararsi. La comunità del Musa Dagh fa di più, e di altro: si tiene insieme come comunità deliberante, terapeutica, liturgica, pedagogica. Il romanzo registra che, nell'assedio, *quel tipo di tenuta* è la posta in gioco. Quando l'apparato amministrativo dell'Impero ottomano ha decretato che gli armeni dei sette villaggi dovessero sparire — e cancellati non solo nel corpo ma come configurazione storica — quella popolazione risponde non solo con le armi ma con un atto ontologico: continuare a esistere come popolo capace di ordinare il proprio mondo.\n\nIl vocabolario dell'analisi fenomenologica può essere utile qui, purché non diventi gergo. C'è una soggettività collettiva che si dà come processo: non è una somma di individui ma una configurazione che si mantiene attraverso il tempo grazie a una co-regolazione (assemblee, riti, milizia, scuola) e a una temporalizzazione (ritenzione della tradizione armena, protensione verso il soccorso o verso la morte). C'è un'ipseità collettiva che resta la stessa attraverso una trasformazione profonda: la comunità di Yoghonoluk e degli altri sei villaggi non è più ciò che era, eppure si riconosce, nel suo accampamento d'altura, come la medesima comunità — anzi, paradossalmente, come *più sé* di prima. Werfel non scrive da fenomenologo, ma scrive di un fenomeno che la fenomenologia ha gli strumenti per nominare: la costituzione di un soggetto, qui collettivo, che si fa tale nel momento stesso in cui qualcun altro ha deciso che debba cessare di essere.\n\nC'è un dettaglio che mostra fino a che punto la cosa sia letterale. Il numero del titolo, quaranta, non corrisponde alla durata storica dell'episodio. La resistenza armena del Musa Dagh durò, secondo le ricostruzioni storiche, circa cinquantatré giorni, tra luglio e settembre del 1915. Werfel sceglie *quaranta* deliberatamente: i quaranta giorni del diluvio, i quaranta giorni di Mosè sul Sinai, la Quaresima, le tentazioni nel deserto. Non è ornamento. È un atto interpretativo che colloca l'episodio in un'altra durata — quella biblica del tempo della prova — e che fa della durata vissuta sulla montagna non una cifra cronachistica ma una grammatica figurale. Il numero stesso del titolo iscrive il fatto che l'opera non racconta una cronaca: racconta una temporalità di senso, un presente denso di passato (la lunga storia armena) e protensione (la morte che si avvicina, il soccorso che forse arriverà), entro cui la comunità abita il tempo che le resta.\n\n## 3. Il limite, la perdita, il resto\n\nA questa costituzione corrisponde, costantemente, il suo contrario. Il romanzo non è una celebrazione: Werfel sa bene — e mostra — che ogni giorno della tenuta è anche un giorno del logoramento. Le scorte si esauriscono. La fame mina i corpi. Le defezioni rompono l'unità interna. L'episodio di Sarkis Kilikian, ex galeotto sopravvissuto a violenze precedenti che si pone come polo di una fazione disperata e radicale, mostra che la comunità non è un blocco compatto: contiene al proprio interno una pulsione che la chiede sciolta. Il processo a Kilikian è uno dei momenti più rivelatori del Libro terzo: la comunità sopravvive all'aggressività interna senza ritirare il legame, ma il prezzo è alto, e il romanzo non lo nasconde.\n\nÈ all'altezza di queste pagine che il libro entra nel suo registro più forte. Non è la sproporzione tra una piccola popolazione e l'apparato di sterminio dell'Impero a costituire l'eccedenza decisiva — sebbene quella sproporzione sia descritta in modo schiacciante. È la perdita irreversibile, la forma estrema del limite reale: ciò che accade senza essere posto, ciò che ha la forma del 'non è possibile'. La morte di Stephan, il figlio adolescente di Gabriel allontanatosi dall'accampamento con il coetaneo Haik e ucciso dai soldati turchi, è il caso emblematico. N